<?xml version="1.0" encoding="UTF-8"?>
<!--Héctor Santiago Loyde Figueroa -->
<veterinaria xmlns:xsi="http://www.w3.org/2001/XMLSchema-instance"
    xsi:noNamespaceSchemaLocation="mascotas.xsd">
<clientes>
    <cliente>
        <ID_Cliente>C-101</ID_Cliente>
        <Nombre_Cliente>Carlos Ruiz</Nombre_Cliente>
        <Teléfono>555-1234</Teléfono>
        <Nombre_Mascota>Toby</Nombre_Mascota>
        <Especie>Perro</Especie>
        <Servicio>Baño y corte</Servicio>
        <Fecha>2026-03-10</Fecha>
        <Costo>350</Costo>
    </cliente>
    <cliente>
        <ID_Cliente>C-101</ID_Cliente>
        <Nombre_Cliente>Carlos Ruiz</Nombre_Cliente>
        <Teléfono>555-1234</Teléfono>
        <Nombre_Mascota>Toby</Nombre_Mascota>
        <Especie>Perro</Especie>
        <Servicio>Vacuna y antirrabia</Servicio>
        <Fecha>2026-03-10</Fecha>
        <Costo>250</Costo>
    </cliente>
    <cliente>
        <ID_Cliente>C-102</ID_Cliente>
        <Nombre_Cliente>Laura Gomez</Nombre_Cliente>
        <Teléfono>555-5678</Teléfono>
        <Nombre_Mascota>Michi</Nombre_Mascota>
        <Especie>Gato</Especie>
        <Servicio>Desparacitación</Servicio>
        <Fecha>2026-03-11</Fecha>
        <Costo>180</Costo>
    </cliente>
    <cliente>
        <ID_Cliente>C-102</ID_Cliente>
        <Nombre_Cliente>Laura Gomez</Nombre_Cliente>
        <Teléfono>555-5678</Teléfono>
        <Nombre_Mascota>Michi</Nombre_Mascota>
        <Especie>Gato</Especie>
        <Servicio>Limpieza Dental</Servicio>
        <Fecha>2026-03-11</Fecha>
        <Costo>400</Costo>
    </cliente>
        <cliente>
        <ID_Cliente>C-103</ID_Cliente>
        <Nombre_Cliente>Roberto Díaz</Nombre_Cliente>
        <Teléfono>555-9012</Teléfono>
        <Nombre_Mascota>Max</Nombre_Mascota>
        <Especie>Perro</Especie>
        <Servicio>Revisión General</Servicio>
        <Fecha>2026-03-12</Fecha>
        <Costo>300</Costo>
    </cliente>
    <cliente>
        <ID_Cliente>C-103</ID_Cliente>
        <Nombre_Cliente>Roberto Díaz</Nombre_Cliente>
        <Teléfono>555-9012</Teléfono>
        <Nombre_Mascota>Max</Nombre_Mascota>
        <Especie>Perro</Especie>
        <Servicio>Corte de uñas</Servicio>
        <Fecha>2026-03-12</Fecha>
        <Costo>100</Costo>
    </cliente>
</clientes>
</veterinaria>